{
  "$schema": "https://quality.studio/schemas/quality-rule.v1.schema.json",
  "schemaVersion": 1,
  "id": "QS-NG-004",
  "version": "1.0.0",
  "title": "Keep templates declarative, typed, and accessible",
  "language": "angular",
  "category": "template-hygiene",
  "statement": "Use Angular control flow and bindings for presentation, keep calculations in typed component state, provide semantic elements and accessible names, and avoid inline styles or imperative DOM manipulation.",
  "rationale": "Quality Studio templates remain readable when they describe structure and state while TypeScript owns calculations. Native semantics preserve keyboard and assistive-technology behavior.",
  "severity": "medium",
  "autofixable": false,
  "defaultEnabled": true,
  "reviewKinds": ["code"],
  "appliesTo": ["**/*.html", "**/*.ts"],
  "examples": {
    "bad": "<div (click)=\"open(path)\" style=\"padding: 8px\">{{ expensiveCalculation(item) }}</div>",
    "good": "<button type=\"button\" (click)=\"open(path)\">{{ item.displayValue }}</button>"
  },
  "history": [{ "version": "1.0.0", "date": "2026-08-12", "change": "Initial Angular template-hygiene seed grounded in Quality Studio templates." }]
}
